<?xml version="1.0" encoding="UTF-8"?>

<!ELEMENT tableShadow (tableStrategy*)>
<!ELEMENT tableStrategy (name,tables,strategyClass)>
<!ELEMENT name (#PCDATA)>
<!ELEMENT tables (#PCDATA)>
<!ELEMENT strategyClass (#PCDATA)>
